{
  "schema": "roguelike_card_game.run_sequence.v1",
  "content_version": "mvp.1.1-trimmed",
  "id": "run.mvp.linear_01",
  "player": {
    "max_hp": 60,
    "base_action_points": 3,
    "cards_per_turn": 5
  },
  "starter_deck": [],
  "nodes": [
    { "order": 1, "encounter_id": "encounter.mvp.normal_01" },
    { "order": 2, "encounter_id": "encounter.mvp.normal_03" },
    { "order": 3, "encounter_id": "encounter.mvp.boss_01" }
  ],
  "completion": {
    "boss_encounter_id": "encounter.mvp.boss_01",
    "success_state": "mvp_cleared"
  }
}
